{
  "version": "0.1",
  "frame": "world",
  "objects": [
    {"id": "sofa_1", "label": "sofa", "center": [0, -1.5, 0.425], "size": [0.9, 2.2, 0.85], "yaw": 1.570796, "front": [1.0, 0.0, 0.0]},
    {"id": "cabinet_1", "label": "cabinet", "center": [0, 1.8, 0.25], "size": [0.45, 1.8, 0.5], "yaw": -1.570796, "front": [1.0, 0.0, 0.0]},
    {"id": "tv_1", "label": "tv", "center": [0, 1.85, 0.9], "size": [0.1, 1.4, 0.8], "yaw": -1.570796, "front": [1.0, 0.0, 0.0]},
    {"id": "coffee_table_1", "label": "coffee table", "center": [0, 0, 0.22], "size": [0.6, 1.2, 0.44], "yaw": 1.570796},
    {"id": "armchair_1", "label": "armchair", "center": [-1.9, -1.2, 0.45], "size": [0.8, 0.8, 0.9], "yaw": 0.0, "front": [1.0, 0.0, 0.0]},
    {"id": "armchair_2", "label": "armchair", "center": [1.9, -1.2, 0.45], "size": [0.8, 0.8, 0.9], "yaw": 3.141593, "front": [1.0, 0.0, 0.0]},
    {"id": "side_table_1", "label": "side table", "center": [-1.35, -2.05, 0.275], "size": [0.45, 0.45, 0.55], "yaw": 0.0},
    {"id": "lamp_1", "label": "lamp", "center": [1.45, -2.1, 0.8], "size": [0.35, 0.35, 1.6], "yaw": 0.0},
    {"id": "plant_1", "label": "plant", "center": [-2.1, 1.6, 0.5], "size": [0.45, 0.45, 1.0], "yaw": 0.0},
    {"id": "plant_2", "label": "plant", "center": [2.1, 1.6, 0.5], "size": [0.45, 0.45, 1.0], "yaw": 0.0},
    {"id": "mug_1", "label": "mug", "center": [-0.35, 0.05, 0.49], "size": [0.08, 0.08, 0.1], "yaw": 0.0},
    {"id": "mug_2", "label": "mug", "center": [0.42, -0.12, 0.49], "size": [0.08, 0.08, 0.1], "yaw": 0.0},
    {"id": "mug_3", "label": "mug", "center": [-1.35, -2.05, 0.6], "size": [0.08, 0.08, 0.1], "yaw": 0.0},
    {"id": "bowl_1", "label": "bowl", "center": [-0.05, -0.18, 0.475], "size": [0.18, 0.18, 0.07], "yaw": 0.0},
    {"id": "book_1", "label": "book", "center": [0.12, 0.18, 0.455], "size": [0.16, 0.24, 0.03], "yaw": 0.3},
    {"id": "book_2", "label": "book", "center": [0.7, 1.75, 0.515], "size": [0.16, 0.24, 0.03], "yaw": 0.0},
    {"id": "picture_1", "label": "picture", "center": [0, -1.88, 1.5], "size": [0.05, 1.2, 0.7], "yaw": 1.570796}
  ],
  "viewpoint": {"position": [-3.0, -3.2, 1.7], "look_at": [0.0, 0.0, 0.4]}
}
